{
  "plan_id": "plan-MIS-104-v1",
  "mission_id": "MIS-104",
  "parent_linear_issue": "NIT-104",
  "plan_version": 1,
  "mission_objective": "Make things better.",
  "desired_outcome": "Unknown until clarified.",
  "success_criteria": ["Owner names a concrete outcome and domain"],
  "domain": "unknown",
  "domain_signals": ["underspecified request"],
  "final_deliverable": "Clarifying question set that unlocks a real Mission restate",
  "explicit_assumptions": [],
  "owner_questions": [
    {
      "id": "q1",
      "question": "What concrete outcome should change, for which system or business area?",
      "blocking": true
    },
    {
      "id": "q2",
      "question": "What would success look like in one sentence?",
      "blocking": true
    }
  ],
  "reasoning_actions": [
    {
      "id": "ra1",
      "action": "Ask only blocking clarifications; do not invent research or build work",
      "produces": "clarification_pack"
    }
  ],
  "integration_required": false,
  "mission_risk_level": "L0",
  "workstreams": [
    {
      "workstream_id": "WS-MIS-104-01",
      "mission_id": "MIS-104",
      "parent_linear_issue": "NIT-104",
      "title": "Clarify outcome and domain before any build or research",
      "objective": "Obtain the minimum blocking answers needed to restate a real Mission; do not invent competitor research, code, or docs workstreams.",
      "required_capabilities": ["docs.write"],
      "dependencies": [],
      "reasoning_action_refs": ["ra1"],
      "is_integration_workstream": false,
      "primary_operator": "unassigned",
      "supporting_operator": null,
      "tools_required": [],
      "inputs": {},
      "expected_output": {
        "type": "document",
        "location_hint": "chat",
        "description": "Clarifying question set that unlocks a real Mission restate"
      },
      "acceptance_criteria": [
        "Only blocking questions asked",
        "No fake domain workstreams created"
      ],
      "risk_level": "L0",
      "approval_required": false,
      "execution_order": 1,
      "status": "proposed",
      "correlation_id": "corr-mis-104",
      "idempotency_key": "ws:MIS-104:01:v1",
      "canonical_token": "AIPOS_WORKSTREAM_ID=WS-MIS-104-01"
    }
  ],
  "correlation_id": "corr-mis-104",
  "created_at": "2026-08-12T18:50:00.000Z",
  "decomposer_version": "ADR-006.v2"
}
